{
  "schemaVersion": 1,
  "profileId": "MouseOnly",
  "displayName": "Mouse-only (sort / browse)",
  "description": "Default profile for FR-SR-02 mouse-only acceptance and FR-IN-03. Uses wheel navigation, primary buttons for flags, X1/X2 for archive pipeline steps with double-confirm (FR-IN-05). Slideshow: right-button + wheel for sibling browse in fullscreen; wheel tilt left or X3 to switch to browse mode at current slide when hardware exposes them.",
  "bindings": {
    "nav.nextImage": [{ "kind": "mouseWheel", "wheel": "Down" }],
    "nav.prevImage": [{ "kind": "mouseWheel", "wheel": "Up" }],
    "sort.flagKeep": [{ "kind": "mouseButton", "button": "Left", "clickCount": 1 }],
    "sort.flagDelete": [
      {
        "kind": "mouseButton",
        "button": "Right",
        "clickCount": 1,
        "notes": "Short click in viewer flags delete; long-press opens context menu (see design doc)."
      }
    ],
    "sort.flagUnset": [{ "kind": "mouseButton", "button": "Middle", "clickCount": 1 }],
    "sort.deleteArchiveWizard": [
      {
        "kind": "mouseButton",
        "button": "X1",
        "clickCount": 1,
        "notes": "Opens delete/archive wizard (scoped to current image parent folder)."
      },
      {
        "kind": "mouseButton",
        "button": "X2",
        "clickCount": 1,
        "notes": "Also opens delete/archive wizard."
      }
    ],
    "sort.clearAllFlags": [
      { "kind": "mouseWheelTilt", "tilt": "Right" },
      {
        "kind": "mouseButton",
        "button": "Middle",
        "clickCount": 3,
        "notes": "Triple middle within ~600ms when wheel tilt is unavailable."
      }
    ],
    "slideshow.switchToBrowseAtCurrentLocation": [
      { "kind": "mouseWheelTilt", "tilt": "Left" },
      {
        "kind": "mouseButton",
        "button": "X3",
        "clickCount": 1,
        "notes": "When OS exposes a sixth discrete button; otherwise use keyboard Tab in slideshow."
      }
    ],
    "slideshow.siblingNextImage": [
      { "kind": "mouseWheel", "wheel": "Down", "heldButtons": ["Right"] }
    ],
    "slideshow.siblingPrevImage": [
      { "kind": "mouseWheel", "wheel": "Up", "heldButtons": ["Right"] }
    ],
    "slideshow.nextTreeImage": [{ "kind": "mouseWheel", "wheel": "Down" }],
    "slideshow.prevTreeImage": [{ "kind": "mouseWheel", "wheel": "Up" }],
    "view.panPreview": [
      {
        "kind": "mouseButton",
        "button": "Left",
        "clickCount": 1,
        "modifiers": ["Shift"],
        "notes": "Drag on primary preview to pan when image exceeds the pane (scrollbars also available)."
      }
    ],
    "view.zoomIn": [{ "kind": "mouseWheel", "wheel": "Up", "modifiers": ["Control"] }],
    "view.zoomOut": [{ "kind": "mouseWheel", "wheel": "Down", "modifiers": ["Control"] }],
    "ui.fullscreen": [
      {
        "kind": "mouseButton",
        "button": "Left",
        "clickCount": 2,
        "notes": "Double-click on viewer chrome / title-safe region; implementation defines hit target."
      }
    ],
    "ui.escape": [
      {
        "kind": "mouseChord",
        "buttons": ["Left", "Right"],
        "notes": "Primary buttons pressed together within ~50ms; ignored during drag gestures."
      }
    ]
  }
}
